{
  "schema": {"name": "corpus-selection", "version": 1},
  "name": "layer-stack-p1-v1",
  "base_corpus": "layer-stack-v1",
  "stage": "P1",
  "partition": "target-visible-v1",
  "states_per_stratum": 5,
  "strata": [
    {"difficulty_class": "W", "difficulty_tags": []},
    {"difficulty_class": "W", "difficulty_tags": ["M"]},
    {"difficulty_class": "G", "difficulty_tags": []},
    {"difficulty_class": "G", "difficulty_tags": ["M"]},
    {"difficulty_class": "S", "difficulty_tags": []},
    {"difficulty_class": "S", "difficulty_tags": ["M"]}
  ],
  "state_ids": [
    "a40274d9ddf1d560b494376f3a22e95d1209aced0e40e86e5a182448f28c8afc",
    "ed4cc810b6e8627cbc1f781665fec05087dd99caaa70eb56264ece359856dee5",
    "bb143a3875f4f6a88c9cf474f9529d7238b49ff1488c22fc1c78e96f1c738228",
    "f5e583e7405799ef4d9049642d0e5086544c55a34dc16c26273905fccc4c57ca",
    "e6fbf04ec963eca2f5b9059cddc29aa4632424685fa4c5397a6109582715ac28",
    "ea732e2cac025cb13c1f135cc31baadcdf6fd54a7e01518e319b2643d1a06c1a",
    "d23b0c33314f759636868392e3faf3a33b34a59d00c6835f72ba57ec4e88ffc6",
    "776727bbebc2324d0032be380159d1fbde4f1448f86a4c8ea6367c14baee537c",
    "a4bffae3bb9043a585fe643c2e7722d85983e64b0d5f24ee2dc69a82a7b45b02",
    "e1dc58732010bfd8b6f37d7052a628c11d01e12fe72bba6adfe0f27b9df5301a",
    "ef6251f120fb319b922b7bd3bdba6648100247a68d76b63c276e25ff7bd23604",
    "31fbc7b8ef232100299e1fc1a14ad40015cd16f068efada30d8dc5f46606bd50",
    "34edf24bbf8618dee42ebee1e54360b53919a224cb0ad223f321bddda5d16150",
    "d49f707d21fabeacec76a5d868c62bc46689e0cc56a53f7fd604e9ea85385fe2",
    "dd46e986bc6ababdec83e1a75421fe1599df82c169ec4e4dc2a05f21dcea718a",
    "80a5897eb01626ffd4ae9074c65a451020e20d4f12c30064e568c7e059070111",
    "69ec69bd2293bc522634936a9b3884aab7bf8b86920aa31329358c2467c5ade5",
    "4f8ff03bfea5b0eb28275bca039b9f2a0831f99d16502df50e713929bbf100a9",
    "e95e27b42517b99f0eea642282de78535e150fd1146dfed3134dd7574ee2ac74",
    "068539a89fd01e97d639a455f0bfed48cc7bfc8163a7c4a22f334e9bbbeb4832",
    "7d10aa3ad417157b3b8431325016780fcd1357105f71d0663395767cf8de9d18",
    "985542b37724b15d02aebae91436489a13d08e3aa833287e9309efd025b99091",
    "1e624a118d47606876f8e13abf9cea7f1e3d480d46c6dd01eda2171a2b517b6b",
    "dfa18259978f3aaca967cf04e80226ec6bd3b8a391deb17ef0dd06e11492aa66",
    "fd2b609ee07cd8cf70d7c68cf7291d9ca833166da76cc02370b6fcb48dc79fdb",
    "0af167c1843e3800ba0a7a0055572811ed1cf34bc691edecfe84d26e5ceec971",
    "f103a1304e64c8e9dcbd7dbc424ab56091c360c9e43ebe9fb1d3318b7e1db47f",
    "2dd43e2c1ec462cb8265c467a2b28301a97622cba78a65f014f83f72b676d324",
    "235974d303955b8801f627df5fd85656c8272e44983f164cb1eaee85d94ad009",
    "a21a45bfd45110e818a4ea0e2a6ef3623774dfc9dcbc49a8a4389141688aa567"
  ]
}
